<?xml version="1.0" encoding="UTF-8"?>
<!DOCTYPE chord PUBLIC "-//JABURJAK//DTD Chord 1.0//EN" "https://chords.jaburjak.cz/dtd/chord-1.dtd">
<chord>
	<name>Dmi</name>
	<def>
		<def-strings>6</def-strings>
		<def-frets>5</def-frets>
		<def-note>
			<note-string>6</note-string> <!-- left to right, starts with 1 -->
			<note-fret>1</note-fret> <!-- top to bottom, starts with 1 -->
		</def-note>
		<def-note>
			<note-string>4</note-string>
			<note-fret>2</note-fret>
		</def-note>
		<def-note>
			<note-string>5</note-string>
			<note-fret>3</note-fret>
		</def-note>
		<def-mark>
			<mark-string>1</mark-string>
			<mark-type>muted</mark-type>
		</def-mark>
		<def-mark>
			<mark-string>2</mark-string>
			<mark-type>muted</mark-type>
		</def-mark>
		<def-mark>
			<mark-string>3</mark-string>
			<mark-type>open</mark-type>
		</def-mark>
	</def>
</chord>