<?xml version="1.0" encoding="UTF-8"?>
<!DOCTYPE chord PUBLIC "-//JABURJAK//DTD Chord 1.0//EN" "https://chords.jaburjak.cz/dtd/chord-1.dtd">
<chord xmlns="https://chords.jaburjak.cz/schema/chord-1.xsd"
       xmlns:xsi="http://www.w3.org/2001/XMLSchema-instance"
       xsi:noNamespaceSchemaLocation="https://chords.jaburjak.cz/schema/chord-1.xsd">
	<name>C</name>
	<alt-names>
		<name>Cdur</name>
		<name>Cmajor</name>
	</alt-names>
	<def>
		<def-strings>6</def-strings>
		<def-frets offset="7">12</def-frets>
		<def-note>
			<note-string>6</note-string>
			<note-fret>8</note-fret>
		</def-note>
		<def-note>
			<note-string>5</note-string>
			<note-fret>8</note-fret>
		</def-note>
		<def-note>
			<note-string>4</note-string>
			<note-fret>9</note-fret>
		</def-note>
		<def-note>
			<note-string>3</note-string>
			<note-fret>10</note-fret>
		</def-note>
		<def-mark>
			<mark-string>1</mark-string>
			<mark-type>muted</mark-type>
		</def-mark>
		<def-mark>
			<mark-string>2</mark-string>
			<mark-type>muted</mark-type>
		</def-mark>
	</def>
</chord>